{
  "schema_version": "1.1.0",
  "id": "cc_stun_v1",
  "game_patch": "16.17.1",
  "cc_type": "STUN",
  "blocked_channels": ["BASIC_ATTACK", "ABILITY", "MOVEMENT", "ITEM_ACTIVE"],
  "interactions": {
    "tenacity_reducible": { "status": "UNVERIFIED", "value": null },
    "cleanse_removable": { "status": "UNVERIFIED", "value": null },
    "qss_removable": { "status": "UNVERIFIED", "value": null },
    "immunity_resistible": { "status": "UNVERIFIED", "value": null },
    "slow_resistance_applies": { "status": "UNVERIFIED", "value": null }
  },
  "verification": {
    "status": "UNVERIFIED",
    "verified_patch": null,
    "notes": "Interaction values remain unknown until the four-step verification chain is complete."
  }
}
